,index_new,atel_num,Sentence,label,process
290,290,11122.0,"Following the report of the flaring event detected by Fermi LAT (Atel#10952), We observed the source in the NIR, finding that on November 27th, 2017 (MJD 2458084.990012) its fluxes correspond to J = 15.032 +/- 0.03, H = 14.293 +/- 0.03 and Ks = 12.998 +/- 0.03.",0.0,follow report flare event detect fermi lat atel observ sourc nir find novemb th mjd flux correspond j h ks 
291,291,11118.0,"The data, which were acquired with the CCD imaging camera on the 40-inch reflector at San Diego State University's Mount Laguna Observatory, yielded the following magnitudes: UT Date (mid exp) Exp (s) Filter Magnitude 2018 Jan 01.076 300 V 18.06 &plusmn; 0.09 2018 Jan 01.080 300 B 18.40 &plusmn; 0.25 2018 Jan 01.084 300 R 18.27 &plusmn; 0.03 2018 Jan 01.302 300 R 18.31 &plusmn; 0.04 2018 Jan 01.306 300 V 18.29 &plusmn; 0.15 2018 Jan 01.309 300 B 18.44 &plusmn; 0.40",0.0,data acquir ccd imag camera inch reflector san diego state univers mount laguna observatori yield follow magnitud ut date mid exp exp filter magnitud jan v plusmn jan b plusmn jan r plusmn jan r plusmn jan v plusmn jan b plusmn
292,292,11126.0,"The data were obtained using the BESSEL B, V, R, I filters between 2018 Jan 01.01 UT - 2018 Jan 03.20 UT with the 0.9 m SARA telescope equipped with ARC CCD camera(Keel et al.<a href="" "">2017</a>), located at the Kitt Peak National Observatory, Arizona.",0.0,data obtain use bessel b v r filter jan ut jan ut sara telescop equip arc ccd camera keel et al href locat kitt peak nation observatori arizona
293,293,11130.0,No X-ray source was detected in the preceding 1.2-ks Swift observation on 2018-01-04.48 UT with an 3&sigma; upper limit of 6.0 &times; 10<SUP>-3</SUP> ct/s.,0.0,x ray sourc detect preced ks swift observ ut sigma upper limit time sup sup ct
294,294,11130.0,"This preliminary estimate is somewhat earlier than the 5.9&plusmn;0.5 days measured in 2014 (ATel #6558, Henze et al.<a href="" "">2015</a>), the 5.7&plusmn;0.5 days seen in 2015 (ATel #7984, Darnley & Henze et al.<a href="" "">2016</a>), and the 5.8 days observed for the peculiar 2016 eruption (ATel #9872).",0.0,preliminari estim somewhat earlier plusmn day measur atel henz et al href plusmn day seen atel darnley henz et al href day observ peculiar erupt atel 
295,295,11131.0,The power law index of the time-averaged spectrum is 2.26 +- 0.16.,0.0,power law index time averag spectrum 
296,296,11131.0,The fluence in the 15-150 keV band is 7.0 +/- 0.6 x 10^-7 erg/cm2.,0.0,fluenc kev band x erg cm 
297,297,11131.0,The 1-sec peak photon flux measured from T+0.17 sec in the 15-150 keV band is 1.2 +- 0.2 ph/cm2/sec.,0.0,sec peak photon flux measur sec kev band ph cm sec
298,298,11134.0,"The data were obtained between 2018 Jan 05.0 UT - Jan 06.5 UT with the 0.96 m and 1.0 SARA telescopes equipped with ARC CCD camera(Keel et al.<a href="" "">2017</a>, located at the Kitt Peak National Observatory (SARA-KPNO), Arizona and Roque de los Muchachos, La Palma, Spain (SARA-ORM), respectively.",0.0,data obtain jan ut jan ut sara telescop equip arc ccd camera keel et al href locat kitt peak nation observatori sara kpno arizona roqu de lo muchacho la palma spain sara orm respect
299,299,11138.0,We obtained an optical spectrum (range 350-900 nm) of SN 2018K on UT Jan. 7.48 2018 with the Lijiang 2.4 m telescope (LJT+YFOSC) at Lijiang Observatory of Yunnan Observatories (YNAO).,0.0,obtain optic spectrum rang nm sn k ut jan lijiang telescop ljt yfosc lijiang observatori yunnan observatori ynao 
300,300,11142.0,"Applying the method described in Kraft et al.(1991, ApJ 374, 344) we found a 3 sigma upper limit in the 0.3-10 keV band with the Swift XRT of 8.7e-3 counts/s which is equivalent to an observed flux in the 0.3-10 keV band of about 4.5e-16 W m^-2.",0.0,appli method describ kraft et al apj found sigma upper limit kev band swift xrt e count equival observ flux kev band e w 
301,301,11143.0,Assuming power law emission with the photon index of 2 and HI column density of 4.16x10^20 cm^-2 this translates to the unabsorbed 0.3-10 keV flux limit of 2x10^-13 ergs/cm^2/s.,0.0,assum power law emiss photon index hi column densiti x cm translat unabsorb kev flux limit x erg cm
302,302,11143.0,"UVW2 16.78 0.06 UVM2 16.55 0.09 UVW1 16.49 0.07 U 16.52 0.07 B 17.57 0.09 V 17.39 0.14 We also use the UVOT images to measure the position of OGLE17jei: 03:14:11.94 -71:12:25.5 +/-0.1"" J2000 which is 1.1"" from the reported position of the host galaxy.",0.0,uvw uvm uvw u b v also use uvot imag measur posit ogl jei jtwothousand report posit host galaxi
303,303,11149.0,"Date (UT) Photometry 2018 Jan 09.823&plusmn;0.008 u'=21.69&plusmn;0.05 2018 Jan 09.840&plusmn;0.008 r'=21.81&plusmn;0.03 2018 Jan 09.856&plusmn;0.008 B= 22.05&plusmn;0.01 2018 Jan 09.872&plusmn;0.008 V= 21.98&plusmn;0.03 The optical light curve evolution of the 2017 eruption has, to date, followed the light curve templates derived from the 2013, 2014, and 2015 eruptions (<a href="" "">Darnley et al.2016</a>.",0.0,date ut photometri jan plusmn u plusmn jan plusmn r plusmn jan plusmn b plusmn jan plusmn v plusmn optic light curv evolut erupt date follow light curv templat deriv erupt href darnley et al 
304,304,11152.0,"Two optical spectra were obtained on UT 2018-01-05.1 and UT 2018-01-06.6 with the MDM 2.4m telescope (+ OSMOS; spectral range 398-686 nm) at KPNO and the 2.4m telescope (LJT + YFOSC) located in Lijiang, China, respectively.",0.0,two optic spectra obtain ut ut mdm telescop osmo spectral rang nm kpno telescop ljt yfosc locat lijiang china respect
305,305,11152.0,"We also identify host H, N, and S emission lines along with narrow Na I D lines at z = 0.0095, which is consistent with the redshift of the host galaxy NGC 7541 at z = 0.0090 via NED.",0.0,also identifi host h n emiss line along narrow na line z consist redshift host galaxi ngc z via ned
306,306,11152.0,"The Na I D lines are partially resolved, and the corresponding D1 and D2 lines have equivalent widths of approximately 0.12 nm and 0.10 nm, indicative of significant host-galaxy dust extinction.",0.0,na line partial resolv correspond line equival width approxim nm nm indic signific host galaxi dust extinct
307,307,11152.0,"The Zeiss-100 photometry measurements are summarized below: Date MJD B Berr V Verr R Rerr I Ierr S notes 20180102 58120.657 19.13 0.14 18.08 0.05 17.46 0.04 17.08 0.04 1 CCD 20180103 58121.760 NaN NaN 18.06 0.06 17.43 0.04 NaN NaN 1 CCD 20180107 58125.660 18.99 0.03 18.03 0.03 17.44 0.05 16.73 0.04 1 CCD The position of SN 2017jmk was serendipitous observed by the Hubble Space Telescope on multiple occasions during the three months prior to discovery, as part of program 15145 (PI: Riess).",0.0,zeiss photometri measur summar date mjd b berr v verr r rerr ierr note ccd nan nan nan nan ccd ccd posit sn jmk serendipit observ hubbl space telescop multipl occas three month prior discoveri part program pi riess 
308,308,11153.0,The NOT Unbiased Transient Survey (NUTS; ATel #8992) collaboration reports the spectroscopic classification of supernova SN 2018Z in host galaxy SDSS J231809.76+212553.5 The observations were performed with the 2.56 m Nordic Optical Telescope equipped with ALFOSC (range 350-950 nm; resolution 1.6 nm) on 2018-01-09.9 UT.,0.0,unbias transient survey nut atel collabor report spectroscop classif supernova sn z host galaxi sdss j observ perform nordic optic telescop equip alfosc rang nm resolut nm ut
309,309,11154.0,"We obtained an optical spectrum (range 510-860 nm) of SN 2018bq(=ASASSN-18ac), discovered by All Sky Automated Survey for Supernova(ASAS-SN), on UT 09.81 2018 with the 2.16-m telescope (+BFOSC) at Xinglong Station of National Astronomical Observatories of China (NAOC).",0.0,obtain optic spectrum rang nm sn bq asassn ac discov sky autom survey supernova asa sn ut telescop bfosc xinglong station nation astronom observatori china naoc 
310,310,11155.0,"Using the AAVSO catalogue for photometric calibration we obtained the following magnitudes of the source (not corrected for the Galactic foreground extinction): V = 17.10 &plusmn; 0.07, R = 17.23 &plusmn; 0.09, I = 17.47 &plusmn; 0.26.",0.0,use aavso catalogu photometr calibr obtain follow magnitud sourc correct galact foreground extinct v plusmn r plusmn plusmn 
311,311,11155.0,On light curve obtained over 3 hours in R-band we detected variations with the period of about 0.068<sup>d</sup> and amplitude 0.15<sup>m</sup> (<a href=' '>Fig.2</a>).,0.0,light curv obtain hour r band detect variat period sup sup amplitud sup sup href fig 
312,312,11158.0,The spin period is changing from 31.69 s to 31.54 s from the start of the first observation to the end of the second one (251.3 ks).,0.0,spin period chang start first observ end second one ks 
313,313,11158.0,The spin-up during this period is -5.4e-7</SUP>s s<SUP>-1</SUP> with additional sinusoidal variations with 6.7e-3 s amplitude and 2.23 d period that we associate with the orbital period.,0.0,spin period e sup sup sup addit sinusoid variat e amplitud period associ orbit period
314,314,11158.0,"The spectrum is described by a powerlaw+black body model, leading to a 0.3-10 keV unabsorbed luminosity of 2.9 and 3.1&times;10<SUP>39</SUP>erg s<SUP>-1</SUP> for the first and second observation, respectively.",0.0,spectrum describ powerlaw black bodi model lead kev unabsorb luminos time sup sup erg sup sup first second observ respect
315,315,11161.0,"We obtained an optical spectrum (range 375-830 nm) of SN 2018dx(=ASASSN-18aj), discovered by All Sky Automated Survey for Supernova(ASAS-SN), on UT 11.8 2018 with the 2.16-m telescope (+BFOSC) at Xinglong Station of National Astronomical Observatories of China (NAOC).",0.0,obtain optic spectrum rang nm sn dx asassn aj discov sky autom survey supernova asa sn ut telescop bfosc xinglong station nation astronom observatori china naoc 
316,316,11162.0,"We obtained spectra of the transient AT 2017ixr (see <a href="" "">TNS</a>) with the SPRAT spectrograph (resolution R ~ 350; <a href="" "">Piascik et al.2014</a>) on the 2-m Liverpool Telescope (LT; <a href="" "">Steele et al.2004</a>) on 2017 Dec 27.90 and 2018 Jan 12.83 UT.",0.0,obtain spectra transient ixr see href tn sprat spectrograph resolut r href piascik et al liverpool telescop lt href steel et al dec jan ut
317,317,11162.0,We also obtained photometry of AT 2017ixr with the IO:O CCD camera on the LT and measure it at V = 17.42 +/- 0.01 on 2017 Dec 27.91 and V = 18.65 +/- 0.02 on 2018 Jan 12.84 UT.,0.0,also obtain photometri ixr io ccd camera lt measur v dec v jan ut
318,318,11164.0,The observations were performed with the 2.56 m Nordic Optical Telescope equipped with ALFOSC (range 350-950 nm; resolution 1.6 nm FWHM) on 2018-01-12 UT.,0.0,observ perform nordic optic telescop equip alfosc rang nm resolut nm fwhm ut
319,319,11166.0,"On November 13th, 2017 MJD(24578070.8843), we found the source with NIR fluxes J = 12.266+/- 0.05, H = 11.524 +/- 0.05 and Ks = 10.627 +/- 0.06 While, on MJD 2457807 the flux in the H band corresponded to H = 12.379 +/- 0.05.",0.0,novemb th mjd found sourc nir flux j h ks mjd flux h band correspond h 
320,320,11166.0,"The source is brightest since the time we started monitoring it (MJD 2455607.62), when the flux in the H band was H = 12.117 +/- 0.04.",0.0,sourc brightest sinc time start monitor mjd flux h band h 
321,321,11167.0,"On January 5th,2018 MJD(2458123.6551), we found the source with NIR fluxes corresponding to J = 11.084 +/- 0.03, H = 10.189 +/- 0.03 and Ks = 9.081 +/- 0.05.",0.0,januari th mjd found sourc nir flux correspond j h ks 
322,322,11167.0,"While, on MJD 2458100.61 the fluxes in the NIR bands corresponded to J = 12.370 =/- 0.07, H = 11.463 +/- 0.05 and K = 10.560 +/- 0.07.",0.0,mjd flux nir band correspond j h k 
323,323,11124.0,"<span class=""inner-pre"" style=""font-size: 13px""> Date UT Band Magnitude Total exposure [s] 2018 01 01.723 V 18.91 &plusmn; 0.08 1800 2018 01 01.840 V 19.03 &plusmn; 0.08 2070 2017 12 31.829 R 18.18 &plusmn; 0.09 1260 2018 01 01.682 R 18.50 &plusmn; 0.08 1080 2018 01 01.796 R 18.57 &plusmn; 0.06 1350 2018 01 01.864 R 18.60 &plusmn; 0.05 1800 2018 01 02.768 R 19.37 &plusmn; 0.14 1170 2018 01 02.921 R 19.42 &plusmn; 0.11 3510 2018 01 01.701 I 18.24 &plusmn; 0.09 1800 2018 01 01.816 I 18.43 &plusmn; 0.10 1800 </span>",0.0,span class inner pre style font size px date ut band magnitud total exposur v plusmn v plusmn r plusmn r plusmn r plusmn r plusmn r plusmn r plusmn plusmn plusmn span
324,324,11168.0,The observations were performed with the Asiago 1.82 m Copernico Telescope equipped with AFOSC (range 340-820 nm; resolution 1.4 nm).,0.0,observ perform asiago copernico telescop equip afosc rang nm resolut nm 
325,325,11173.0,"elliptical error region with long and short radii of 0.16 deg and 0.14 deg, respectively.",0.0,ellipt error region long short radii deg deg respect
326,326,11173.0,"elliptical error region with long and short radii of 0.26 deg and 0.17 deg, respectively.",0.0,ellipt error region long short radii deg deg respect
327,327,11173.0,"After an unobservable period from November 23 (MJD 58080) to December 6 (MJD 58093) to avoid solar X-rays, the 2-10 keV count rate obtained with the image fitting method (Morii et al.2016, PASJ, 68S, a11) was 0.035(+0.009, -0.008) counts/s/cm2 (~16 mCrab) on December 7, and then decreased exponentially with a time constant of 16.9 +/- 3.3 days.",0.0,unobserv period novemb mjd decemb mjd avoid solar x ray kev count rate obtain imag fit method morii et al pasj count cm mcrab decemb decreas exponenti time constant day
328,328,11173.0,"An averaged GSC spectrum obtained from November 16 to December 24 was described by an absorbed power-law with a photon index of 2.0 +/- 0.3 and a hydrogen column density nH of (2.8+/-1.5)E22 atoms/cm2 (reduced chi-square: 0.63), or with an absorbed blackbody with a temperature of kT = 1.5 +/- 0.2 keV and nH of < 8.2E21 atoms/cm2 at the 90% confidence level for this nH (reduced chi-square: 0.76).",0.0,averag gsc spectrum obtain novemb decemb describ absorb power law photon index hydrogen column densiti nh e atom cm reduc chi squar absorb blackbodi temperatur kt kev nh e atom cm confid level nh reduc chi squar 
329,329,11175.0,"The SN was discovered at 16.5 mag, which assuming a distance modulus of 31.1 mag for the host galaxy NGC 2525 (Tully et al., 2013, AJ, 146, 86T), corresponds to an absolute magnitude of -14.8 -- or at least 4 mag below peak brightness.",0.0,sn discov mag assum distanc modulu mag host galaxi ngc tulli et al aj correspond absolut magnitud least mag peak bright
330,330,11179.0,"The signal with the highest significance was found from the observation performed on April 22, 2017 (obsid: 00049834010) and we infer a spin period of 26.65&plusmn;0.1 s. Considering the initial spin period reported for the system (31.6 s; ATel#11158) we derive an average spin-up rate -4.6&times;10<SUP>-7</SUP> s over 123 days.",0.0,signal highest signific found observ perform april obsid infer spin period plusmn consid initi spin period report system atel deriv averag spin rate time sup sup day
331,331,11181.0,The observations were performed with the Asiago 1.82 m Copernico Telescope equipped with AFOSC (range 340-820 nm; resolution 1.4 nm).,0.0,observ perform asiago copernico telescop equip afosc rang nm resolut nm 
332,332,11183.0,"Nova Muscae 2018 (PNV J11261220-6531086), discovered o 2018 Jan. 14.5 (V=7.0) was observed spectroscopically on 2018 Jan. 16.46 (MJD 58134.982), with a LHIRES spectrograph mounted on a C11 reflector (35micron slit, 2400 lines/mm, R > 11000) with a total exposure time of 1200 sec in the interval 6520-6690A.",0.0,nova musca pnv j discov jan v observ spectroscop jan mjd lhire spectrograph mount c reflector micron slit line mm r total exposur time sec interv
333,333,11185.0,"The reported coordinates are consistent with those of a bright (I = 15.04 mag), red (V-I = 3.07 mag) star OGLE-LMC173.6.14223 (R.A. = 05:36:30.20, Decl.= -67:59:37.0, J2000.0).",1.0,report coordin consist bright mag red v mag star ogl lmc  ra decl jtwothousand 
334,334,11185.0,"It has a relatively high proper motion (mu_RA = 10.07 +/- 0.14 mas/yr, mu_Decl = 45.49 +/- 0.14 mas/yr) according to the catalog of <a href="" "">Poleski et al.(2012)</a>.",0.0,rel high proper motion mu ra ma yr mu decl ma yr accord catalog href poleski et al 
335,335,11187.0,"A low resolution optical spectrum was also taken on 2017-12-19 with Asiago 1.82m Copernico Telescope with AFOSC instrument (range 340-820 nm; resolution 1.4 nm), showed a featureless continuum in rest-frame ultraviolet.",0.0,low resolut optic spectrum also taken asiago copernico telescop afosc instrument rang nm resolut nm show featureless continuum rest frame ultraviolet
336,336,11190.0,"We obtained for the target the following optical and NIR magnitudes: V = 14.39+/-0.05, R = 13.96+/-0.14, I = 13.37+/-0.08 J = 12.10+/-0.02, H = 11.27+/-0.04, K = 10.27+/-0.04 The NIR magnitudes were calibrated against the 2MASS catalog; optical calibration was performed against the APASS catalog.",0.0,obtain target follow optic nir magnitud v r j h k nir magnitud calibr mass catalog optic calibr perform apass catalog
337,337,11195.0,Examination of the data ( ) shows the source at a level of >8 sigma on two consecutive days: 0.0101+-0.0012 ct/s/cm2 (46 mCrab) on 2018-Jan-15 (MJD 58133) and 0.0130+-0.0016 ct/s/cm2 (59 mCrab) on 2018-Jan-16 (MJD 58134).,0.0,examin data show sourc level sigma two consecut day ct cm mcrab jan mjd ct cm mcrab jan mjd 
338,338,11195.0,"An examination of the BAT light curve before this bright flare shows a high-flux state at >3 sigma significance between Jan 10-12, 2018 (0.0032+-0.0010 ct/s/cm2, 0.0030+-0.0009 ct/s/cm2, and 0.0049+-0.0011 ct/s/cm2, respectively).",0.0,examin bat light curv bright flare show high flux state sigma signific jan ct cm ct cm ct cm respect 
339,339,11197.0,"They are based on three all-sky surveys (2MASS, WISE, GAIA), Hubble Guide Star Catalog and two Magellanic Clouds surveys (MCPS and SAGE(Meixner et al.2006)), resulting of a SED between ~ 0.37 and 22.2µm.",0.0,base three sky survey mass wise gaia hubbl guid star catalog two magellan cloud survey mcp sage meixner et al result sed
340,340,11201.0,"Since 2018-01-11UT, a significant gamma-ray source has been seen in the direction of the nova candidate with averaged TS = 65 (8-sigma detection significance) and F(100MeV-300GeV) = 2.4 x 10^-7 ph/cm^2/s (photon index of 2.2 assumed).",0.0,sinc ut signific gamma ray sourc seen direct nova candid averag ts sigma detect signific f mev gev x ph cm photon index assum 
341,341,11202.0,"The data were obtained on 2018 Jan 19.45 with the 0.96 m SARA telescope equipped with ARC CCD camera(Keel et al.<a href="" "">2017</a>), located at the Kitt Peak National Observatory, Arizona.",0.0,data obtain jan sara telescop equip arc ccd camera keel et al href locat kitt peak nation observatori arizona
342,342,11203.0,"The photometry of the nova was obtained just before the time of the BTA spectrum with the same device gave B = 18.48 &plusmn; 0.06, V = 18.14 &plusmn; 0.03, Rc = 17.81 &plusmn; 0.05.",0.0,photometri nova obtain time bta spectrum devic gave b plusmn v plusmn rc plusmn 
343,343,11204.0,We used the Blue Channel Spectrograph mounted on the 6.5m MMT Telescope (3400-8400 angstroms) and FAST on the 1.5m Tillinghast Telescope (3500-7300 angstroms).,0.0,use blue channel spectrograph mount mmt telescop angstrom fast tillinghast telescop angstrom 
344,344,11205.0,"We obtained an optical spectrum (range 375-830 nm) of SN 2018ie (=kait-18A),discovered by Lick Supernova Survey, on UT Jan. 19.81 2018 with the 2.16-m telescope (+BFOSC) at Xinglong Station of National Astronomical Observatories of China (NAOC).",0.0,obtain optic spectrum rang nm sn ie kait discov lick supernova survey ut jan telescop bfosc xinglong station nation astronom observatori china naoc 
345,345,11206.0,The observation was performed with the 2.56 m Nordic Optical Telescope equipped with ALFOSC on 2018-01-20.08 UT (range 350-950 nm; resolution 1.6 nm).,0.0,observ perform nordic optic telescop equip alfosc ut rang nm resolut nm 
346,346,11207.0,"The object was discovered 2018 1 20.64 UT at R~17.9 mag during the ongoing D<40 Mpc (DLT40) one day cadence supernova search, using data from the PROMPT 5 0.41m telescope located at CTIO.",0.0,object discov ut r mag ongo mpc dlt one day cadenc supernova search use data prompt telescop locat ctio
347,347,11207.0,A confirmation image was obtained on 2018 1 20.65 using a COJ 0.4m telescope at Sliding Spring Observatory in NSW Australia as a part of the Las Cumbres Observatory network.,0.0,confirm imag obtain use coj telescop slide spring observatori nsw australia part la cumbr observatori network
348,348,11208.0,"Using a fit with an absorbed power law, the source is found to have an absorbed flux of 3.5 (+/-0.3)e-10 erg/s/cm2 for the 0.3-10 keV band, with photon index (gamma)=1.36(+/-0.16) and N(H)=5.1(+/-1.3)e21/cm2, for the PC mode (w-statistic=368/411).",0.0,use fit absorb power law sourc found absorb flux e erg cm kev band photon index gamma n h e cm pc mode w statist 
349,349,11211.0,"The young Type Ia SN 2018gv (ATel #11175, #11177) in the galaxy NGC 2525 has been observed with the Australia Telescope Compact Array (ATCA) at 5.5 and 9.0 GHz on 2018 Jan 18.6 UT.",0.0,young type ia sn gv atel galaxi ngc observ australia telescop compact array atca ghz jan ut
350,350,11211.0,"Adopting the host galaxy distance from Tully et al.(2013, AJ, 146, 86) of 16.8 Mpc, this implies an upper limit on the 9.0 GHz luminosity of 1.0E25 erg/s/Hz.",0.0,adopt host galaxi distanc tulli et al aj mpc impli upper limit ghz luminos e erg hz
351,351,11213.0,"We obtained an optical spectrum (range 350-916 nm) of SN 2018if,discovered by the Tsinghua-NAOC Transient Survey, on UT Jan. 20.7 2018 with the Lijiang Gaomeigu 2.4-m telescope (+YFOSC) at Lijiang Station of Yunnan Observatories of China.",0.0,obtain optic spectrum rang nm sn discov tsinghua naoc transient survey ut jan lijiang gaomeigu telescop yfosc lijiang station yunnan observatori china
352,352,11214.0,"Following the last detection in a 6.2-ks Swift/XRT pointing on 2017-01-17.17 UT, with a count rate of (0.7&plusmn;0.1) &times; 10<SUP>-2</SUP> ct/s, no source was found in the subsequent 4.2-ks observation on 2017-01-18.24 UT (3&sigma; upper limit of 0.3 &times; 10<SUP>-2</SUP> ct/s).",0.0,follow last detect ks swift xrt point ut count rate plusmn time sup sup ct sourc found subsequ ks observ ut sigma upper limit time sup sup ct 
353,353,11214.0,"This value is broadly consistent with the SSS turn-off observed for the eruptions in 2013 (day 19&plusmn;1; <a href="" "">Henze et al.2014</a>), 2014 (day 18.4&plusmn;0.5; ATel #6604 and <a href="" "">Henze et al.2015a</a>), and 2015 (day 18.6&plusmn;0.7; ATel #8062 and <a href="" "">Darnley et al.2016</a>); but is significantly longer than for the peculiar 2016 eruption (before day 16; ATel #9907 and Henze et al.2018 submitted).",0.0,valu broadli consist sss turn observ erupt day plusmn href henz et al day plusmn atel href henz et al day plusmn atel href darnley et al significantli longer peculiar erupt day atel henz et al submit 
354,354,11215.0,"Following the report of the visible detection the source by the MASTER project (Atel#10985), We have observed the source in the NIR, finding that on January 6th,2018 (MJD 2458124.7406) its fluxes corresponded to J = 15.296 +/- 0.04, H = 14.743 +/- 0.03 and Ks = 13.200 +/- 0.06.",0.0,follow report visibl detect sourc master project atel observ sourc nir find januari th mjd flux correspond j h ks 
355,355,11215.0,"The flux in Ks being 5.5 times brighter than the previously determined value by our team (Ks = 15.044 +/- 0.05 on MJD 2458084.8680) Our observations are carried out with the 2.1m telescope of the Guillermo Haro Observatory operated by the National Institute for Astrophysics, Optics and Electronics (Mexico), equipped with the instrument CANICA a NIR camera.",0.0,flux ks time brighter previous determin valu team ks mjd observ carri telescop guillermo haro observatori oper nation institut astrophys optic electron mexico equip instrument canica nir camera
356,356,11219.0,"We obtained an optical spectrum (range 350-900 nm) of SN 2018iq (=AT2017jzx), discovered by Koichi Itagaki, on UT 2018 Jan. 20.7 with the Li-Jiang 2.4 m telescope (LJT+YFOSC) at Li-Jiang Observatory of Yunnan Observatories.",0.0,obtain optic spectrum rang nm sn iq jzx discov koichi itagaki ut jan li jiang telescop ljt yfosc li jiang observatori yunnan observatori
357,357,11220.0,The 3-sigma upper limit on the 0.3-10 keV count rate is 0.025 cts/s.,0.0,sigma upper limit kev count rate ct
358,358,11223.0,"The integral gamma-ray flux is 5.9e-12 &plusmn 7.7e-13 photons cm^-2 s^-1 above 350 GeV (corresponding to about 6% of the flux of the Crab Nebula above the same energy), about twice the flux typically measured in this orbital phase range.",0.0,integr gamma ray flux e plusmn e photon cm gev correspond flux crab nebula energi twice flux typic measur orbit phase rang
359,359,11223.0,Swift XRT observations on MJD 58142 show a 0.3-10 keV count rate of 0.060 &plusmn 0.007.,0.0,swift xrt observ mjd show kev count rate plusmn 
360,360,11224.0,"The Type Ic SN 2018ec (ATel #11156, #11160) in the nearby Luminous Infrared Galaxy NGC 3256 has been observed with the Australia Telescope Compact Array (ATCA) at 5.5 and 9.0 GHz on 2018 Jan 23.8 UT.",0.0,type ic sn ec atel nearbi lumin infrar galaxi ngc observ australia telescop compact array atca ghz jan ut
361,361,11227.0,The corresponding photon spectral index of 1.96+/-0.08 is significantly harder than the 3FGL value of 2.25+/-0.05.,0.0,correspond photon spectral index significantli harder fgl valu 
